[
  {"event_type":"process.started","seq":0,"occurred_at":"2026-02-21T12:00:00Z","payload":{"run_id":"run_ref_001","stream_id":"stream.main","cursor":0,"phase":"init"},"schema_version":"1.0.0","correlation_id":"corr_ref_001","process_id":"process_ref_001","causation_id":null,"metadata":{"source":"ai","tenant_id":"tenant_demo"}},
  {"event_type":"task.started","seq":1,"occurred_at":"2026-02-21T12:00:01Z","payload":{"run_id":"run_ref_001","stream_id":"stream.main","cursor":1,"task_id":"task_001","task_name":"scaffold"},"schema_version":"1.0.0","correlation_id":"corr_ref_001","process_id":"process_ref_001","causation_id":"seq:0"},
  {"event_type":"tool.called","seq":2,"occurred_at":"2026-02-21T12:00:02Z","payload":{"run_id":"run_ref_001","stream_id":"stream.main","cursor":2,"tool":"code.scaffold","call_id":"call_001"},"schema_version":"1.0.0","correlation_id":"corr_ref_001","process_id":"process_ref_001","causation_id":"seq:1","metadata":{"source":"core","tenant_id":"tenant_demo"}},
  {"event_type":"tool.succeeded","seq":3,"occurred_at":"2026-02-21T12:00:03Z","payload":{"run_id":"run_ref_001","stream_id":"stream.main","cursor":3,"tool":"code.scaffold","call_id":"call_001"},"schema_version":"1.0.0","correlation_id":"corr_ref_001","process_id":"process_ref_001","causation_id":"seq:2"},
  {"event_type":"artifact.created","seq":4,"occurred_at":"2026-02-21T12:00:04Z","payload":{"run_id":"run_ref_001","stream_id":"stream.main","cursor":4,"artifact_id":"artifact_001","artifact_uri":"artifact://run_ref_001/a1"},"schema_version":"1.0.0","correlation_id":"corr_ref_001","process_id":"process_ref_001","causation_id":"seq:3","metadata":{"source":"core","tenant_id":"tenant_demo"}},
  {"event_type":"ui.delta","seq":5,"occurred_at":"2026-02-21T12:00:05Z","payload":{"run_id":"run_ref_001","stream_id":"stream.main","cursor":5,"panel":"workspace","delta":"scaffold complete"},"schema_version":"1.0.0","correlation_id":"corr_ref_001","process_id":"process_ref_001","causation_id":"seq:4"},
  {"event_type":"task.completed","seq":6,"occurred_at":"2026-02-21T12:00:06Z","payload":{"run_id":"run_ref_001","stream_id":"stream.main","cursor":6,"task_id":"task_001"},"schema_version":"1.0.0","correlation_id":"corr_ref_001","process_id":"process_ref_001","causation_id":"seq:5","metadata":{"source":"ai","tenant_id":"tenant_demo"}},
  {"event_type":"process.completed","seq":7,"occurred_at":"2026-02-21T12:00:07Z","payload":{"run_id":"run_ref_001","stream_id":"stream.main","cursor":7,"result":"ok","duration_ms":422},"schema_version":"1.0.0","correlation_id":"corr_ref_001","process_id":"process_ref_001","causation_id":"seq:6"},
  {"event_type":"transport.snapshot","seq":8,"occurred_at":"2026-02-21T12:00:08Z","payload":{"run_id":"run_ref_001","stream_id":"stream.main","cursor":8,"snapshot_id":"snap_001","snapshot_uri":"artifact://run_ref_001/snapshots/001","state_hash":"sha256:a1b2c3d4e5f6a1b2c3d4e5f6a1b2c3d4e5f6a1b2c3d4e5f6a1b2c3d4e5f6a1b2"},"schema_version":"1.0.0","correlation_id":"corr_ref_001","process_id":"process_ref_001","causation_id":"seq:7","metadata":{"source":"core","tenant_id":"tenant_demo"}},
  {"event_type":"transport.replay_boundary","seq":9,"occurred_at":"2026-02-21T12:00:09Z","payload":{"run_id":"run_ref_001","stream_id":"stream.main","cursor":9,"boundary":"head","replay_complete":true},"schema_version":"1.0.0","correlation_id":"corr_ref_001","process_id":"process_ref_001","causation_id":"seq:8"}
]
